{
  "contractVersion": "0.1-draft",
  "kind": "host-sequence-vector",
  "id": "vector.host-sequence.recovery.store.changed-context",
  "description": "Adding an optional semantic context field changes the canonical intent: an accepted key with absent locale refuses the same argument when locale becomes present.",
  "profile": "studio.profile/host-baseline-v2",
  "assertions": ["idempotency-changed-context-refusal"],
  "idempotencyPolicy": {
    "scopeFields": ["idempotencyKey", "operationId", "resourceContextKey", "sessionGeneration"],
    "argumentCanonicalization": "canonical-json",
    "intentContextFields": ["expectedRevision", "locale", "protocolVersion"],
    "absentOptionalFields": "omit",
    "numberNormalization": "canonical-json",
    "excludedContextFields": ["requestId", "traceContext"]
  },
  "given": { "artifacts": [], "permissions": [], "sessionGeneration": "session-r1" },
  "steps": [
    {
      "action": "invoke",
      "id": "store-without-locale",
      "port": "recovery",
      "operation": "store",
      "context": {
        "operationId": "studio.operation/recovery.store",
        "protocolVersion": "0.1.0-draft.2",
        "requestId": "requests/store-without-locale",
        "resourceContextKey": "contexts/context-intent",
        "sessionGeneration": "session-r1",
        "idempotencyKey": "idempotency/context-intent"
      },
      "argument": { "draft": "retained" },
      "completion": "settled",
      "expect": { "outcome": "result", "value": "null" }
    },
    {
      "action": "invoke",
      "id": "store-with-locale",
      "port": "recovery",
      "operation": "store",
      "context": {
        "operationId": "studio.operation/recovery.store",
        "protocolVersion": "0.1.0-draft.2",
        "requestId": "requests/store-with-locale",
        "resourceContextKey": "contexts/context-intent",
        "sessionGeneration": "session-r1",
        "idempotencyKey": "idempotency/context-intent",
        "locale": "en"
      },
      "argument": { "draft": "retained" },
      "completion": "settled",
      "expect": { "outcome": "error", "category": "invalid-request", "retryable": false }
    }
  ],
  "expectFinal": {
    "recovery": [
      { "resourceContextKey": "contexts/context-intent", "value": { "draft": "retained" } }
    ],
    "pendingPreviewRenders": 0,
    "previewDeliveries": []
  }
}
