{
  "contractVersion": "0.1-draft",
  "kind": "host-sequence-vector",
  "id": "vector.host-sequence.artifact.publish.changed-intent",
  "description": "A publication key accepted for one artifact reference refuses a changed argument before concurrency evaluation, while preserving the exact seeded kind, revision and session generation.",
  "profile": "studio.profile/host-baseline-v2",
  "assertions": ["idempotency-changed-argument-refusal"],
  "idempotencyPolicy": {
    "scopeFields": ["idempotencyKey", "operationId", "resourceContextKey", "sessionGeneration"],
    "argumentCanonicalization": "canonical-json",
    "intentContextFields": ["expectedRevision", "locale", "protocolVersion"],
    "absentOptionalFields": "omit",
    "numberNormalization": "canonical-json",
    "excludedContextFields": ["requestId", "traceContext"]
  },
  "given": {
    "artifacts": [
      {
        "id": "vector.model",
        "kind": "content-model",
        "revision": "upstream-content-r41",
        "status": "draft"
      }
    ],
    "permissions": ["studio.permission/publish"],
    "sessionGeneration": "session-live-r41"
  },
  "steps": [
    {
      "action": "invoke",
      "id": "publish-first",
      "port": "artifact",
      "operation": "publish",
      "context": {
        "operationId": "studio.operation/artifact.publish",
        "protocolVersion": "0.1.0-draft.2",
        "requestId": "requests/publish-first",
        "resourceContextKey": "contexts/vector",
        "sessionGeneration": "session-live-r41",
        "expectedRevision": "upstream-content-r41",
        "idempotencyKey": "idempotency/publish-model"
      },
      "argument": { "id": "vector.model", "version": "1.0.0" },
      "completion": "settled",
      "expect": {
        "outcome": "result",
        "revisionAdvancesFrom": "upstream-content-r41",
        "value": "null"
      }
    },
    {
      "action": "invoke",
      "id": "publish-changed-intent",
      "port": "artifact",
      "operation": "publish",
      "context": {
        "operationId": "studio.operation/artifact.publish",
        "protocolVersion": "0.1.0-draft.2",
        "requestId": "requests/publish-changed",
        "resourceContextKey": "contexts/vector",
        "sessionGeneration": "session-live-r41",
        "expectedRevision": "upstream-content-r41",
        "idempotencyKey": "idempotency/publish-model"
      },
      "argument": { "id": "vector.model", "version": "2.0.0" },
      "completion": "settled",
      "expect": { "outcome": "error", "category": "invalid-request", "retryable": false }
    }
  ],
  "expectFinal": {
    "artifacts": [{ "id": "vector.model", "status": "published", "revisionFrom": "publish-first" }],
    "pendingPreviewRenders": 0,
    "previewDeliveries": []
  }
}
