{
  "contractVersion": "0.1-draft",
  "kind": "host-sequence-vector",
  "id": "vector.host-sequence.artifact.publish.idempotent-replay",
  "description": "In-flight and completed retries of an accepted publication coalesce on one result, do not consume another rate-limit unit, and ignore per-attempt request and trace correlation.",
  "profile": "studio.profile/host-baseline-v2",
  "assertions": ["idempotent-in-flight-coalescing", "idempotent-completed-replay"],
  "idempotencyPolicy": {
    "scopeFields": ["idempotencyKey", "operationId", "resourceContextKey", "sessionGeneration"],
    "argumentCanonicalization": "canonical-json",
    "intentContextFields": ["expectedRevision", "locale", "protocolVersion"],
    "absentOptionalFields": "omit",
    "numberNormalization": "canonical-json",
    "excludedContextFields": ["requestId", "traceContext"]
  },
  "given": {
    "artifacts": [
      {
        "id": "vector.blueprint",
        "kind": "blueprint",
        "revision": "vector.blueprint-r1",
        "status": "draft"
      }
    ],
    "permissions": ["studio.permission/publish"],
    "sessionGeneration": "session-r1",
    "rateLimits": [
      {
        "operationId": "studio.operation/artifact.publish",
        "maximumRequests": 1,
        "windowMilliseconds": 60000,
        "retryAfterMilliseconds": 60000
      }
    ]
  },
  "steps": [
    {
      "action": "invoke",
      "id": "publish-first",
      "port": "artifact",
      "operation": "publish",
      "context": {
        "operationId": "studio.operation/artifact.publish",
        "protocolVersion": "0.1.0-draft.2",
        "requestId": "requests/publish-first",
        "resourceContextKey": "contexts/vector",
        "sessionGeneration": "session-r1",
        "expectedRevision": "vector.blueprint-r1",
        "idempotencyKey": "idempotency/publish-vector",
        "traceContext": { "traceparent": "trace-first" }
      },
      "argument": { "id": "vector.blueprint", "version": "1.0.0" },
      "completion": "pending"
    },
    {
      "action": "invoke",
      "id": "publish-coalesced",
      "port": "artifact",
      "operation": "publish",
      "context": {
        "operationId": "studio.operation/artifact.publish",
        "protocolVersion": "0.1.0-draft.2",
        "requestId": "requests/publish-coalesced",
        "resourceContextKey": "contexts/vector",
        "sessionGeneration": "session-r1",
        "expectedRevision": "vector.blueprint-r1",
        "idempotencyKey": "idempotency/publish-vector",
        "traceContext": { "traceparent": "trace-coalesced" }
      },
      "argument": { "id": "vector.blueprint", "version": "1.0.0" },
      "completion": "settled",
      "expect": {
        "outcome": "result",
        "revisionAdvancesFrom": "vector.blueprint-r1",
        "value": "null"
      }
    },
    {
      "action": "settle",
      "id": "publish-first-settled",
      "invocation": "publish-first",
      "expect": { "outcome": "result", "sameAs": "publish-coalesced", "value": "null" }
    },
    {
      "action": "invoke",
      "id": "publish-completed-replay",
      "port": "artifact",
      "operation": "publish",
      "context": {
        "operationId": "studio.operation/artifact.publish",
        "protocolVersion": "0.1.0-draft.2",
        "requestId": "requests/publish-completed",
        "resourceContextKey": "contexts/vector",
        "sessionGeneration": "session-r1",
        "expectedRevision": "vector.blueprint-r1",
        "idempotencyKey": "idempotency/publish-vector",
        "traceContext": { "traceparent": "trace-completed" }
      },
      "argument": { "id": "vector.blueprint", "version": "1.0.0" },
      "completion": "settled",
      "expect": { "outcome": "result", "sameAs": "publish-first", "value": "null" }
    }
  ],
  "expectFinal": {
    "artifacts": [
      { "id": "vector.blueprint", "status": "published", "revisionFrom": "publish-first" }
    ],
    "pendingPreviewRenders": 0,
    "previewDeliveries": []
  }
}
