{
  "contractVersion": "0.1-draft",
  "kind": "host-sequence-vector",
  "id": "vector.host-sequence.preview.render.cancelled",
  "description": "A renderer completion released after cancellation cannot escape: cancel returns null, render settles cancelled, and the late result is not delivered.",
  "profile": "studio.profile/host-baseline-v2",
  "assertions": ["in-flight-preview-cancellation", "late-preview-result-discard"],
  "idempotencyPolicy": {
    "scopeFields": ["idempotencyKey", "operationId", "resourceContextKey", "sessionGeneration"],
    "argumentCanonicalization": "canonical-json",
    "intentContextFields": ["expectedRevision", "locale", "protocolVersion"],
    "absentOptionalFields": "omit",
    "numberNormalization": "canonical-json",
    "excludedContextFields": ["requestId", "traceContext"]
  },
  "given": { "artifacts": [], "permissions": [], "sessionGeneration": "session-r1" },
  "steps": [
    {
      "action": "invoke",
      "id": "render-pending",
      "port": "preview",
      "operation": "render",
      "context": {
        "operationId": "studio.operation/preview.render",
        "protocolVersion": "0.1.0-draft.2",
        "requestId": "requests/preview-render",
        "resourceContextKey": "contexts/vector",
        "sessionGeneration": "session-r1"
      },
      "argument": {
        "artifactId": "vector.blueprint",
        "draftDigest": "b03cc45a784d7cd4d2836e24694d42f9c8e2ee3dde3ceca79b0a147436db47c6",
        "draftRevision": "vector-blueprint-r1",
        "requestId": "renders/cancelled-1",
        "viewport": "desktop"
      },
      "completion": "pending"
    },
    {
      "action": "invoke",
      "id": "cancel-render",
      "port": "preview",
      "operation": "cancel",
      "context": {
        "operationId": "studio.operation/preview.cancel",
        "protocolVersion": "0.1.0-draft.2",
        "requestId": "requests/preview-cancel",
        "resourceContextKey": "contexts/vector",
        "sessionGeneration": "session-r1"
      },
      "argument": "b03cc45a784d7cd4d2836e24694d42f9c8e2ee3dde3ceca79b0a147436db47c6",
      "completion": "settled",
      "expect": { "outcome": "result", "value": "null" }
    },
    {
      "action": "release-preview-render",
      "id": "release-late-render",
      "invocation": "render-pending",
      "value": {
        "draftDigest": "b03cc45a784d7cd4d2836e24694d42f9c8e2ee3dde3ceca79b0a147436db47c6",
        "markers": [],
        "markerMap": {},
        "diagnostics": [],
        "requestId": "renders/cancelled-1"
      }
    },
    {
      "action": "settle",
      "id": "render-cancelled",
      "invocation": "render-pending",
      "expect": { "outcome": "error", "category": "cancelled", "retryable": false }
    }
  ],
  "expectFinal": { "pendingPreviewRenders": 0, "previewDeliveries": [] }
}
